{
  "civs": {
    "Armenians": {
      "disabled": [
        12,
        37,
        51,
        63,
        80,
        85,
        188,
        218,
        221,
        246,
        265,
        279,
        320,
        373,
        376,
        377,
        428,
        436,
        437,
        608
      ],
      "free": []
    },
    "Aztecs": {
      "disabled": [
        15,
        25,
        37,
        39,
        50,
        51,
        63,
        64,
        80,
        81,
        82,
        85,
        156,
        166,
        175,
        188,
        192,
        204,
        209,
        218,
        219,
        221,
        239,
        244,
        254,
        265,
        375,
        376,
        379,
        428,
        429,
        435,
        436,
        437,
        907,
        909,
        910,
        911,
        1138,
        1142
      ],
      "free": []
    },
    "Bengalis": {
      "disabled": [
        54,
        64,
        77,
        85,
        96,
        162,
        166,
        188,
        192,
        209,
        218,
        244,
        255,
        265,
        279,
        320,
        321,
        379,
        428,
        436,
        437,
        439,
        910,
        1138,
        1142
      ],
      "free": []
    },
    "Berbers": {
      "disabled": [
        51,
        63,
        64,
        221,
        230,
        231,
        237,
        255,
        265,
        320,
        321,
        429,
        436,
        875,
        910,
        1138,
        1142
      ],
      "free": []
    },
    "Bohemians": {
      "disabled": [
        12,
        54,
        80,
        192,
        218,
        244,
        246,
        255,
        265,
        320,
        373,
        375,
        379,
        380,
        428,
        428,
        435,
        436,
        437,
        875,
        907,
        1138,
        1142
      ],
      "free": [
        55,
        182,
        278,
        279
      ]
    },
    "Britons": {
      "disabled": [
        12,
        64,
        85,
        188,
        192,
        218,
        255,
        265,
        279,
        316,
        319,
        320,
        376,
        428,
        435,
        436,
        437,
        439,
        904,
        910,
        1138,
        1142
      ],
      "free": []
    },
    "Bulgarians": {
      "disabled": [
        15,
        45,
        54,
        64,
        85,
        100,
        188,
        194,
        219,
        221,
        230,
        231,
        237,
        237,
        244,
        246,
        264,
        265,
        319,
        321,
        373,
        375,
        376,
        379,
        608,
        907,
        909,
        910,
        1138,
        1142
      ],
      "free": []
    },
    "Burgundians": {
      "disabled": [
        192,
        218,
        219,
        237,
        237,
        239,
        244,
        255,
        320,
        373,
        375,
        377,
        380,
        435,
        436,
        437,
        438,
        439,
        716,
        875,
        1138,
        1142
      ],
      "free": []
    },
    "Burmese": {
      "disabled": [
        64,
        85,
        212,
        219,
        237,
        244,
        246,
        255,
        265,
        279,
        320,
        321,
        373,
        379,
        437,
        439,
        608,
        909,
        910,
        1138,
        1142
      ],
      "free": []
    },
    "Byzantines": {
      "disabled": [
        37,
        50,
        51,
        75,
        239,
        320,
        321,
        376,
        377,
        380,
        435,
        436,
        441,
        910,
        1138,
        1142
      ],
      "free": [
        8,
        280
      ]
    },
    "Celts": {
      "disabled": [
        12,
        51,
        54,
        64,
        80,
        85,
        188,
        192,
        201,
        215,
        218,
        221,
        230,
        233,
        237,
        246,
        316,
        319,
        376,
        435,
        436,
        437,
        438,
        909,
        910,
        1138,
        1142
      ],
      "free": []
    },
    "Chinese": {
      "disabled": [
        12,
        15,
        37,
        54,
        85,
        188,
        218,
        246,
        257,
        265,
        316,
        320,
        358,
        376,
        377,
        379,
        428,
        436,
        439,
        716,
        875,
        907,
        910,
        1138,
        1142
      ],
      "free": []
    },
    "Cumans": {
      "disabled": [
        37,
        39,
        51,
        54,
        63,
        64,
        85,
        140,
        188,
        189,
        194,
        201,
        230,
        233,
        237,
        239,
        244,
        279,
        316,
        373,
        375,
        376,
        377,
        438,
        608,
        712,
        716,
        875,
        907,
        909,
        910,
        1138,
        1142
      ],
      "free": []
    },
    "Danes": {
      "disabled": [
        12,
        15,
        37,
        45,
        51,
        54,
        64,
        85,
        188,
        192,
        194,
        209,
        218,
        221,
        237,
        244,
        265,
        319,
        321,
        376,
        428,
        436,
        439,
        441,
        605,
        904,
        905,
        909,
        910,
        1138,
        1142
      ],
      "free": []
    },
    "Dravidians": {
      "disabled": [
        12,
        51,
        54,
        80,
        96,
        162,
        166,
        182,
        192,
        209,
        218,
        233,
        252,
        255,
        265,
        279,
        316,
        321,
        377,
        428,
        435,
        436,
        439,
        1138,
        1142
      ],
      "free": []
    },
    "Ethiopians": {
      "disabled": [
        12,
        54,
        64,
        80,
        85,
        230,
        244,
        246,
        264,
        265,
        316,
        376,
        379,
        435,
        436,
        608,
        875,
        907,
        909,
        910,
        1138,
        1142
      ],
      "free": []
    },
    "Franks": {
      "disabled": [
        15,
        63,
        64,
        192,
        201,
        218,
        219,
        221,
        237,
        237,
        255,
        279,
        316,
        319,
        320,
        321,
        373,
        376,
        380,
        428,
        435,
        436,
        437,
        910,
        1138,
        1142
      ],
      "free": [
        12,
        13,
        14
      ]
    },
    "Georgians": {
      "disabled": [
        64,
        182,
        188,
        219,
        221,
        233,
        237,
        244,
        265,
        319,
        373,
        375,
        376,
        380,
        437,
        904,
        907,
        909,
        910
      ],
      "free": []
    },
    "Goths": {
      "disabled": [
        18,
        37,
        63,
        64,
        77,
        80,
        140,
        182,
        189,
        194,
        230,
        237,
        255,
        265,
        316,
        319,
        320,
        375,
        376,
        377,
        379,
        436,
        437,
        439,
        602,
        608,
        716,
        875,
        1138,
        1142
      ],
      "free": []
    },
    "Gurjaras": {
      "disabled": [
        15,
        45,
        64,
        75,
        96,
        162,
        166,
        192,
        197,
        209,
        215,
        218,
        219,
        221,
        230,
        237,
        246,
        255,
        264,
        265,
        320,
        375,
        376,
        377,
        429,
        436,
        608,
        875,
        909,
        910,
        1138,
        1142
      ],
      "free": []
    },
    "Hindustanis": {
      "disabled": [
        12,
        15,
        51,
        54,
        63,
        64,
        77,
        96,
        162,
        166,
        209,
        237,
        239,
        244,
        246,
        255,
        265,
        319,
        320,
        321,
        373,
        375,
        380,
        429,
        436,
        439,
        608,
        875,
        909,
        910,
        1138,
        1142
      ],
      "free": []
    },
    "Huns": {
      "disabled": [
        12,
        37,
        51,
        54,
        63,
        64,
        77,
        85,
        140,
        188,
        194,
        219,
        230,
        237,
        239,
        246,
        257,
        264,
        279,
        316,
        320,
        373,
        376,
        377,
        379,
        380,
        438,
        441,
        469,
        608,
        716,
        875,
        904,
        909,
        910,
        1138,
        1142
      ],
      "free": []
    },
    "Incas": {
      "disabled": [
        25,
        37,
        39,
        51,
        64,
        80,
        81,
        82,
        85,
        156,
        166,
        175,
        188,
        192,
        204,
        207,
        209,
        217,
        218,
        221,
        222,
        244,
        252,
        254,
        264,
        265,
        319,
        320,
        376,
        428,
        435,
        436,
        716,
        875,
        907,
        909,
        910,
        1138,
        1142
      ],
      "free": []
    },
    "Italians": {
      "disabled": [
        182,
        192,
        218,
        239,
        244,
        255,
        265,
        320,
        321,
        377,
        429,
        436,
        439,
        875,
        1138,
        1142
      ],
      "free": []
    },
    "Japanese": {
      "disabled": [
        12,
        15,